{
  "machine": {
    "cpu": "x86_64",
    "gpu": "NVIDIA GeForce RTX 3090, 580.173.02, 24576",
    "logical_cpus": 32,
    "platform": "Linux-7.0.0-29-generic-x86_64-with-glibc2.39"
  },
  "measurements": [
    {
      "commands": {
        "before_each_sample": {
          "command": "clear-project-compiled-unit-cache"
        },
        "capacity_primer_counts_by_seed": {
          "19": 1,
          "20": 2,
          "21": 2,
          "22": 2,
          "23": 1,
          "24": 1,
          "25": 1,
          "26": 2,
          "27": 1,
          "28": 1,
          "29": 1,
          "30": 1,
          "31": 1,
          "32": 1,
          "33": 1,
          "34": 1,
          "35": 1,
          "36": 1,
          "37": 1,
          "38": 1,
          "39": 1
        },
        "daemon_start": {
          "argv": [
            "/home/andrew-peterson/code/laniusc/target/release/laniusc",
            "daemon",
            "--stdio",
            "--backend",
            "x86_64",
            "--stdlib-root",
            "/home/andrew-peterson/code/laniusc/stdlib",
            "--idle-buffer-timeout-ms",
            "0"
          ],
          "cwd": "/home/andrew-peterson/code/laniusc",
          "display": "/home/andrew-peterson/code/laniusc/target/release/laniusc daemon --stdio --backend x86_64 --stdlib-root /home/andrew-peterson/code/laniusc/stdlib --idle-buffer-timeout-ms 0",
          "environment_overrides": {}
        },
        "sample_compile_requests": [
          {
            "command": "compile",
            "emit": "x86_64",
            "id": "measure-0",
            "input": "/home/andrew-peterson/code/laniusc/target/lanius-perf-workloads/single-file-1mb-x86_64/seed-20/1000000/scaling.lani",
            "output": "/home/andrew-peterson/code/laniusc/target/lanius-perf-artifacts/single-file-1mb-x86_64/daemon_warm_workspace-0.bin"
          },
          {
            "command": "compile",
            "emit": "x86_64",
            "id": "measure-1",
            "input": "/home/andrew-peterson/code/laniusc/target/lanius-perf-workloads/single-file-1mb-x86_64/seed-21/1000000/scaling.lani",
            "output": "/home/andrew-peterson/code/laniusc/target/lanius-perf-artifacts/single-file-1mb-x86_64/daemon_warm_workspace-1.bin"
          },
          {
            "command": "compile",
            "emit": "x86_64",
            "id": "measure-2",
            "input": "/home/andrew-peterson/code/laniusc/target/lanius-perf-workloads/single-file-1mb-x86_64/seed-22/1000000/scaling.lani",
            "output": "/home/andrew-peterson/code/laniusc/target/lanius-perf-artifacts/single-file-1mb-x86_64/daemon_warm_workspace-2.bin"
          },
          {
            "command": "compile",
            "emit": "x86_64",
            "id": "measure-3",
            "input": "/home/andrew-peterson/code/laniusc/target/lanius-perf-workloads/single-file-1mb-x86_64/seed-23/1000000/scaling.lani",
            "output": "/home/andrew-peterson/code/laniusc/target/lanius-perf-artifacts/single-file-1mb-x86_64/daemon_warm_workspace-3.bin"
          },
          {
            "command": "compile",
            "emit": "x86_64",
            "id": "measure-4",
            "input": "/home/andrew-peterson/code/laniusc/target/lanius-perf-workloads/single-file-1mb-x86_64/seed-24/1000000/scaling.lani",
            "output": "/home/andrew-peterson/code/laniusc/target/lanius-perf-artifacts/single-file-1mb-x86_64/daemon_warm_workspace-4.bin"
          },
          {
            "command": "compile",
            "emit": "x86_64",
            "id": "measure-5",
            "input": "/home/andrew-peterson/code/laniusc/target/lanius-perf-workloads/single-file-1mb-x86_64/seed-25/1000000/scaling.lani",
            "output": "/home/andrew-peterson/code/laniusc/target/lanius-perf-artifacts/single-file-1mb-x86_64/daemon_warm_workspace-5.bin"
          },
          {
            "command": "compile",
            "emit": "x86_64",
            "id": "measure-6",
            "input": "/home/andrew-peterson/code/laniusc/target/lanius-perf-workloads/single-file-1mb-x86_64/seed-26/1000000/scaling.lani",
            "output": "/home/andrew-peterson/code/laniusc/target/lanius-perf-artifacts/single-file-1mb-x86_64/daemon_warm_workspace-6.bin"
          },
          {
            "command": "compile",
            "emit": "x86_64",
            "id": "measure-7",
            "input": "/home/andrew-peterson/code/laniusc/target/lanius-perf-workloads/single-file-1mb-x86_64/seed-27/1000000/scaling.lani",
            "output": "/home/andrew-peterson/code/laniusc/target/lanius-perf-artifacts/single-file-1mb-x86_64/daemon_warm_workspace-7.bin"
          },
          {
            "command": "compile",
            "emit": "x86_64",
            "id": "measure-8",
            "input": "/home/andrew-peterson/code/laniusc/target/lanius-perf-workloads/single-file-1mb-x86_64/seed-28/1000000/scaling.lani",
            "output": "/home/andrew-peterson/code/laniusc/target/lanius-perf-artifacts/single-file-1mb-x86_64/daemon_warm_workspace-8.bin"
          },
          {
            "command": "compile",
            "emit": "x86_64",
            "id": "measure-9",
            "input": "/home/andrew-peterson/code/laniusc/target/lanius-perf-workloads/single-file-1mb-x86_64/seed-29/1000000/scaling.lani",
            "output": "/home/andrew-peterson/code/laniusc/target/lanius-perf-artifacts/single-file-1mb-x86_64/daemon_warm_workspace-9.bin"
          },
          {
            "command": "compile",
            "emit": "x86_64",
            "id": "measure-10",
            "input": "/home/andrew-peterson/code/laniusc/target/lanius-perf-workloads/single-file-1mb-x86_64/seed-30/1000000/scaling.lani",
            "output": "/home/andrew-peterson/code/laniusc/target/lanius-perf-artifacts/single-file-1mb-x86_64/daemon_warm_workspace-10.bin"
          },
          {
            "command": "compile",
            "emit": "x86_64",
            "id": "measure-11",
            "input": "/home/andrew-peterson/code/laniusc/target/lanius-perf-workloads/single-file-1mb-x86_64/seed-31/1000000/scaling.lani",
            "output": "/home/andrew-peterson/code/laniusc/target/lanius-perf-artifacts/single-file-1mb-x86_64/daemon_warm_workspace-11.bin"
          },
          {
            "command": "compile",
            "emit": "x86_64",
            "id": "measure-12",
            "input": "/home/andrew-peterson/code/laniusc/target/lanius-perf-workloads/single-file-1mb-x86_64/seed-32/1000000/scaling.lani",
            "output": "/home/andrew-peterson/code/laniusc/target/lanius-perf-artifacts/single-file-1mb-x86_64/daemon_warm_workspace-12.bin"
          },
          {
            "command": "compile",
            "emit": "x86_64",
            "id": "measure-13",
            "input": "/home/andrew-peterson/code/laniusc/target/lanius-perf-workloads/single-file-1mb-x86_64/seed-33/1000000/scaling.lani",
            "output": "/home/andrew-peterson/code/laniusc/target/lanius-perf-artifacts/single-file-1mb-x86_64/daemon_warm_workspace-13.bin"
          },
          {
            "command": "compile",
            "emit": "x86_64",
            "id": "measure-14",
            "input": "/home/andrew-peterson/code/laniusc/target/lanius-perf-workloads/single-file-1mb-x86_64/seed-34/1000000/scaling.lani",
            "output": "/home/andrew-peterson/code/laniusc/target/lanius-perf-artifacts/single-file-1mb-x86_64/daemon_warm_workspace-14.bin"
          },
          {
            "command": "compile",
            "emit": "x86_64",
            "id": "measure-15",
            "input": "/home/andrew-peterson/code/laniusc/target/lanius-perf-workloads/single-file-1mb-x86_64/seed-35/1000000/scaling.lani",
            "output": "/home/andrew-peterson/code/laniusc/target/lanius-perf-artifacts/single-file-1mb-x86_64/daemon_warm_workspace-15.bin"
          },
          {
            "command": "compile",
            "emit": "x86_64",
            "id": "measure-16",
            "input": "/home/andrew-peterson/code/laniusc/target/lanius-perf-workloads/single-file-1mb-x86_64/seed-36/1000000/scaling.lani",
            "output": "/home/andrew-peterson/code/laniusc/target/lanius-perf-artifacts/single-file-1mb-x86_64/daemon_warm_workspace-16.bin"
          },
          {
            "command": "compile",
            "emit": "x86_64",
            "id": "measure-17",
            "input": "/home/andrew-peterson/code/laniusc/target/lanius-perf-workloads/single-file-1mb-x86_64/seed-37/1000000/scaling.lani",
            "output": "/home/andrew-peterson/code/laniusc/target/lanius-perf-artifacts/single-file-1mb-x86_64/daemon_warm_workspace-17.bin"
          },
          {
            "command": "compile",
            "emit": "x86_64",
            "id": "measure-18",
            "input": "/home/andrew-peterson/code/laniusc/target/lanius-perf-workloads/single-file-1mb-x86_64/seed-38/1000000/scaling.lani",
            "output": "/home/andrew-peterson/code/laniusc/target/lanius-perf-artifacts/single-file-1mb-x86_64/daemon_warm_workspace-18.bin"
          },
          {
            "command": "compile",
            "emit": "x86_64",
            "id": "measure-19",
            "input": "/home/andrew-peterson/code/laniusc/target/lanius-perf-workloads/single-file-1mb-x86_64/seed-39/1000000/scaling.lani",
            "output": "/home/andrew-peterson/code/laniusc/target/lanius-perf-artifacts/single-file-1mb-x86_64/daemon_warm_workspace-19.bin"
          }
        ]
      },
      "compiler": {
        "name": "lanius",